file_name,transcription
data/baraa_ytb_part0046.mp3,بصح خصاتو حاجة قالتلها جميلة و واش لي خصاتو يا خالتي قالتلها خاصتو العين تاع الفضة
data/baraa_ytb_part0047.mp3,شافت معاها جميلة و قالتلها وانا منين راحا نجيب العين هادي تاع الفضة نطقت ليها لعجوز و قاتلها العين تاع الفضة تلقايها في
data/baraa_ytb_part0048.mp3,بلاد العجايب قالتلها جيبيها باش يكمل لجنان تاعك و يولي خير من هاكا وراحت الستوت و خلات جميلة
data/baraa_ytb_part0049.mp3,و جميلة كلاها الفضول باه تجيب هاديك العين كي جا خوها من الصيد قالتلو يا خويا لازملي لعين تاع الفضة
data/baraa_ytb_part0050.mp3,وبلاستها في بلاد العجايب ماحبش خوها المرة لولة بقات تحاول فيه قبل لغدوة منداك
data/baraa_ytb_part0051.mp3,هز حصانو وراح وهو في طريقو لقا واحد الشايب شعرو بيض ولحيتو بيضة سقساه وقالو ياوليدي
data/baraa_ytb_part0052.mp3,نتا وين اك رايح قالو جميل انا ني رايح لعين الفضة شاف ليه الشايب وقالو هادا لي بعثك مايشتيلكش الخير
data/baraa_ytb_part0053.mp3,قالو الطريق هادي واعرة شاف معاه جميل وقالو ختي هيا لي بعثتني و ختي تحبني وانا مانقدرش نرفضلها طلب
data/baraa_ytb_part0054.mp3,شاف معاه هاداك الشايب و قالو شوف ياوليدي روح كمل فطريق هادي تلقى قدام العين حنش هو كي يعود راقد
data/baraa_ytb_part0055.mp3,او يبقى حال عينيه كي يعود فاطن راهو يقفل عينيه قالو اتفكر كلامي كي توصل للعين هاديك قبل ما تهز منها ال
data/baraa_ytb_part0056.mp3,ما شوف مع الحنش اذا لقيت عينيه محلولين ازرب هز الما ويلا لقيتو مغمضهم سما فاضل ماتقربش راح جميل
data/baraa_ytb_part0057.mp3,و كمل فهاديك الطريق حتى وصل للعين كي وصل جميل للعين لقا هاداك لحنش حال عينيه سما راقد زرب جميل هز الدلوة
data/baraa_ytb_part0058.mp3,تاعو وزرب عمرها من العين وركب فوق حصانو ورجع يجري للدار كي وصل لدار راح حكم الدلوة هاديك وصبها فلعين تاع
data/baraa_ytb_part0059.mp3,لجنينة ولات العين فضية فرحت جميلة بزاف وبقات تسنى
data/baraa_ytb_part0060.mp3,باه تجيها لعجوز الستوت و تشوفها و كيما كان الحال راح جميل صباح
data/baraa_ytb_part0061.mp3,يصيد كي لعادة و كي ستوت عرفت بالوقت تاع جميل خرج من الدار راحت وطبطبت على جميلة حالتلها جميلة لباب دخلت الستوت
data/baraa_ytb_part0062.mp3,وهيا داهشة لقات لما تاع العين فضي شافت مع جميلة و قالتلها والله يا بنتي لا جنانك زاد
data/baraa_ytb_part0063.mp3,ولا خير من لي كان قالتلها بصح خصاتو حاجة نطقت ليها جميلة وقالتلها واش خصاتو تاني يا خالتي
data/baraa_ytb_part0064.mp3,قالتلها ديك الستوت خاصاتو شجرة يكون الورقة منها تغني غناية مختلفة على ختها وراحت وخلات جميلة
data/baraa_ytb_part0065.mp3,كي لعادة فضولها قتلها و سنات خوها حتى جا و قالتلو ياخويا جيبلي الشجرة لي كل ورقة منها تغني غناية
data/baraa_ytb_part0066.mp3,شاف جميل معاها و قالها او نتي هبلتي بالاك انا عرضت حياتي للخطر لمرة لي فاتت ونتي زايدة تقوليلي زيد روح بقات تحاول فيه
data/baraa_ytb_part0067.mp3,و تقولو روح برك اخويا مشي انا ختك وعزيزة عليك شاف جميل معاها و ما لقى مايهدر وقالها لغدوة صباح نوض نروح نجيبهالك
data/baraa_ytb_part0068.mp3,غدوة منداك ناض جميل صباح بكري وحكم الطريق و في طريقو زاد لقى نفس الشايب لي لقاه لمرة لي فاتت
data/baraa_ytb_part0069.mp3,وقالو وين اك رايح ياوليدي زدت وليت لهنا نطق جميل و قالو راهي ختي حاولتني وانا كيما تعرف
data/baraa_ytb_part0070.mp3,مانقدرش نرفضلها طلب المهم الشايب هاداك زاد وصاه و قالو شوف اوليدي كمل فالطريق وكي توصل لهاد الشجرة
data/baraa_ytb_part0071.mp3,تلقا عاسها صيد و حكايتو  كيما حكاية لحنش لا لقيتو مغمض عينيه يسما راهو فاطن ويلا لقيتو حال عينيه
data/baraa_ytb_part0072.mp3,سما راهو راقد زرب هز الغصن تاع الشجرة تاعك وسير في طريقك مدلو مراية قالو حكمها عندك ياولدي كي تخرج اذا صراتلك حاجة مشي مليحة
data/baraa_ytb_part0073.mp3,المراية هادي رايحة تولي كحلة كمل جميل الطريق حتى وصل للشجرة ولقى هاداك الصيد ولقاه حال عينيه يعني لقاه
data/baraa_ytb_part0074.mp3,راقد هبط جميل من الخيل تاعو وزرب نحى الغصن من الشجرة و راح يجري للدار كي وصل
data/baraa_ytb_part0075.mp3,راح غرس هاداك الغصن في لجنينة تاعهم فرحت جميلة بزاف كي لقات الشجرة هاديك كل ورقة تغني غناية
data/baraa_ytb_part0076.mp3,بقات تسنى في الستوت باه تزيد تاطيها رايها ولغدوة منداك راح جميل يصيد كي لعادة وجات الستوت و حلتلها جميلة
data/baraa_ytb_part0077.mp3,الباب كي حلتلها الباب دخلت الستوت وهي في بالها بلي راهي رايحة تكون تخلصت من جميل بصح المفاجئة انها
data/baraa_ytb_part0078.mp3,لقات الشجرة لي كل ورقة منها تغني غناية دهشت هاديك الستوت بصح مابينتش الدهشة تاعها لجميلة و دارتلها و قالتلها
data/baraa_ytb_part0079.mp3,راهو لجنان تاعكم راهو ولا ما شاء الله عليه بصح مازالت خاصاتو حاجة شافت معاها جميلة وقالتلها
data/baraa_ytb_part0080.mp3,واش باقي خاص تاني يا خالتي قالتلها الستوت خاصك الفرخ لي يهدر وتلقايه في نفس
data/baraa_ytb_part0081.mp3,لبلاصة وراحت كي لعادة وخلات جميلة تاكل في بعضاها و كي جا خوها م الصيد حكمتو وبقات تحاول فيه وتقولو
data/baraa_ytb_part0082.mp3,ياخويا لعزيز انا ختك روح جيبلي هاد العجايب وجيبلي لفرخ هادا والله راح يكون آخر طلب ليا
data/baraa_ytb_part0083.mp3,ماقبلش جميل وبقات تحاول فيه و تحاول فيه حتى قالها سلمت أمري لله غدوة نروح نجيبهولك وكيما كان الحال
data/baraa_ytb_part0084.mp3,حكم جميل الطريق توكل على ربي و راح و في الطريق كي لعادة هاداك لي شعرو بيض و لحيتو بيضة
data/baraa_ytb_part0085.mp3,وقالو وين زيد رايح ياولدي قالو جميل لحكاية و قالو راهي ختي تحوس على العصفور لي يتكلم
data/baraa_ytb_part0086.mp3,شاف ليه الشايب و قالو مهمتك هاد المرة صعيبة شوف انا واش نقولك هاذ العص
data/baraa_ytb_part0087.mp3,فور راه مكار صعيب هو يدير روحو راقد بصح ماهوش راقد يحط راسو تحت جناحو ويهدر ويقول انا ني
data/baraa_ytb_part0088.mp3,راح نرقد ولي حاب يحكمني يحكمني نتا ماتسمعلوش على خاطر كون تروح الد
data/baraa_ytb_part0089.mp3,قيقة لي يهدر فيها راهو يحكمك وتولي حجر وراك كون توصل تما و تشوف هادوك لحجر راهم ماهومش حجر راهم عباد  لي جاو يحكموه
data/baraa_ytb_part0090.mp3,وتحولو لحجر قالو اوليدي كمل كمل في طريقك حتى توصل كمل جميل الطريق وصل للشجرة
data/baraa_ytb_part0091.mp3,هاديك ولقى العصفور هاداك راح فوق غصن الشجرة وحط راسو تحت جناحو وقال انا ني راح نرقد و
data/baraa_ytb_part0092.mp3,لي حاب يحكمني يجي يحكمني وجميل بلا تردد صوطا عندو وحكمو وفهاديك اللحظة تحول لحجرة
data/baraa_ytb_part0093.mp3,وكانت فالدار جميلة كانت ساعة على ساعة تروح للمراية هاديك تشوف ليها وفاللحظة لي تحول فيها جميل لحجرة ولات لمراية هاديك
data/baraa_ytb_part0094.mp3,كحلة خافت جميلة على خوها وولات تبكي مبعدا قالت وين راه الحل واش رايحة ندير انا ضركا مبعد قالت السبيل الوحيد باه
data/baraa_ytb_part0095.mp3,نوصل لخويا هو اني نروح لبلاد العجايب وهي في طريقها تلاقات بالشايب هاداك لي موالف يلقاه جميل
data/baraa_ytb_part0096.mp3,كي شافها راح ليها و قالها يا بنيتي وين راكي رايحة حكاتلو لحكاية وقبل ماتكمل قالها
data/baraa_ytb_part0097.mp3,مشي خوك جميل نطقت ليه جميلة وقاتلو انعم ايه جميل خويا و راهو شو وش ما صرالوكملي يا بنتي في طريقك
data/baraa_ytb_part0098.mp3,تلقاي الشجرة لي عليها هاد العصفور لي يتكلم قالها ماديريش كيما دار جميل انا ني وصيتو لكن هوا تسرع
data/baraa_ytb_part0099.mp3,باه يحكمو و راهو تحول لحجرة  بقات تسمع جميلة لهاداك الشايب وقالها العصفور يروح فوق غصن الشجرة
data/baraa_ytb_part0100.mp3,يحط راسو تحت جناحو ويقول لي حب يحكمني يقدم انا ني راح نرقد قالها ماديريش فيه لامان قالها حتى تفوت
data/baraa_ytb_part0101.mp3,زمان قالها سع وروحي حكميه راحت جميلة وصلت للشجرة ولقات لفرخ و دار كيما قالها الشيخ
data/baraa_ytb_part0102.mp3,حط راسو تحت جناحو و قال انا ني رايح نرقد لي حب يحكمني يجي ماتسرعتش جميلة وبقات تسنى مدة
data/baraa_ytb_part0103.mp3,من الزمان حتى تأكدت بلي العصفور هاداك رقد صح راحت ليه و حكمتو مع حكمتو بدات تسقسي فيه
data/baraa_ytb_part0104.mp3,وين خويا قولي ويناهو خويا نطقلها العصفور و قالها انايا خوك عبالي بلي راهو حجرة مالحجرات هادو
data/baraa_ytb_part0105.mp3,بصح باه نقولك وينه فيهم اه نكدب عليك قاتلو وشي هو الحل قالها الحل تاعك هو انك تروحي للعين تاع الفضة
data/baraa_ytb_part0106.mp3,و تجيبي طاس كبيه علحجر قالها ضوك يخرج خوك راحت جميلة للعين وصلت ليها عمرت طاسها من العين
data/baraa_ytb_part0107.mp3,وراحت تجري للبلاصة لي فيها لحجر وبقات كل مرة تصب قطرة على حجرة
data/baraa_ytb_part0108.mp3,و هي تتحول و تولي انسان ومالقاتش خوها حتى بقاتلها قطرة فطاس راحت صبتها على الحجرة لخرة وتحولت هاديك
data/baraa_ytb_part0109.mp3,الحجرة ولات جميل عنقتو ختو وبقات تبكي وتقولو سامحني ياخويا وكي وصلو بالسلامة لدارهم
data/baraa_ytb_part0110.mp3,ورتحو شوية قاتلو حكاية الستوت رقدو الخاوة وفصباح ماحبش جميل يروح يصيد وهو يسنى فالس
data/baraa_ytb_part0111.mp3,توت وكي لعادة جات الستوت طبطب باه تشوف وش صرا راح العصفور وصرفقلها عينيها
data/baraa_ytb_part0112.mp3,علابالو بلي راهي تقدر تأذيهم ولات هاديك العجوز تبكي وماشية فالطريق راح ليها جميل وحكمها قالها رواحي هنا قالها وين راكي
data/baraa_ytb_part0113.mp3,رايحة قوليلي شكون لي بعثك لينا باه تأذينا نطقت ليه لعجوز وحكاتلو حكاية خوالاتو و قاتلو بلي هوما
data/baraa_ytb_part0114.mp3,كي شافوكم خافو لكان يتكشف أمرهم وبعثوني ليكم باه نقضي عليكم طلق جميل هاديك الستوت وبقا يحوس في حيلة باه
data/baraa_ytb_part0115.mp3,يتوصل بيها لباباه السلطان دبر عليه الفرخ دبارة وقالو نقولك ا جميل وش دير نتوما عندكم لعجب فهاد لجنان تاعكم و
data/baraa_ytb_part0116.mp3,السلطان يحب لحوايج هادو مالا ديرلو عرضة و عرضو و تما يتعرف عليكم خدا جميل بنصيحة العصفور ودار وش طلب
data/baraa_ytb_part0117.mp3,منو و قدم عرضة للسلطان السلطان مارفضش طلبو وراح كي وصل السلطان للدار
data/baraa_ytb_part0118.mp3,شاف في لقصر هاداك منبهر بهادوك لحوايج العجيبة لي راهم فيه مبعدا راح قعد وقال وين هوما مالين الدار
data/baraa_ytb_part0119.mp3,جا جميل و جميلة مع شافهم السلطان عرفهم بلي راهم ولادو ملقرن لي فوق راسهم فرح بزاف
data/baraa_ytb_part0120.mp3,وبكى و عنقهم حكالو جميل و جميلة حكايتهم و وش قاتلهم الستوت السلطان هز ولادو وتوجه
data/baraa_ytb_part0121.mp3,لقصر وفك سراح امهم وعاقب خواتات مرتو عقاب شديد وعاشو العاي
data/baraa_ytb_part0122.mp3,لة تاع جميل و جميلة بسعادة وهناء وسلام في حكاية أخرى ان شاء الله
data/baraa_litama_2_part0001.mp3,للقبر و يرضعو من هاذاك الضرع تباعت البقرة بصح لولاد مازالو كيما راهم
data/baraa_litama_2_part0002.mp3,شابين و صحاح حارت مرت باباهم و وصات بنتها تبعهم و تشوفهم واش ياكلو
data/baraa_litama_2_part0003.mp3,و تاكل كيفهم باه تكبر و تزيان كيما هوما تَبعتهم لقاتهم راحوا للقبر
data/baraa_litama_2_part0004.mp3,تاع ماماهم و كي فاقوا باللي راها تعس فيهم دارو روحهم ياكلوا في الحشيش كلات كيفهم
data/baraa_litama_2_part0005.mp3,بالصح مازيانتش صفارت و مرضت مرت باباهم ضَربَتْهُم و قالتَلهم علاه أنتم تاكلو
data/baraa_litama_2_part0006.mp3,الحشيش تكبرو و هي مَرْضَت كي راحت ترقد بقات تخمم كيفاش تدير باش تتهنى منهم
data/baraa_litama_2_part0007.mp3,قالت لراجلها يا راجل البلاد هاذي ما فيهاش الخير لازم نرحلوا منها
data/baraa_litama_2_part0008.mp3,الصباح ناضوا بكري و لمو قشهم و رحلوا فالطريق جازوا على واد
data/baraa_litama_2_part0009.mp3,مَدت للطفل كَسْكاس و قالتلو عمر فيه الماء و مدت للطفْلَة الصوف كحلۃ
data/baraa_litama_2_part0010.mp3,و قالتَلها رديها بيضَة راحوا لَولاد مساكن للواد و بدى الطْفل يعمر في الكسكاس
data/baraa_litama_2_part0011.mp3,و هو يقطر و الطفلة تغسل في الصوف ما تنقاتش وَلى
data/baraa_litama_2_part0012.mp3,الطْفَل يْغلق في الكَسِكاسِ بالطين باش يتعمرلو بالماء جاء ليه زاوش و قالو طري بالطينْ
data/baraa_litama_2_part0013.mp3,يَا مَسْكين نَاسَكْ رَحلوا و أنت في العين كي سمعو الزاوش يقوللهم هكذاْ فاقوا بلي
data/baraa_litama_2_part0014.mp3,كاين حاجة و رَواحوا للدَار مَرت باباهم قْبَل ما ترِحَل
data/baraa_litama_2_part0015.mp3,خَبْزَتلهم الكسرة و دارت فيها الرهْج و رَبطت الكلب في الرحى الطاحونة   هو يدور و
data/baraa_litama_2_part0016.mp3,المَطحنة دور معاه باه مايفيقوش لولاد بلي راحو و خلاوهم دخلو لولاد
data/baraa_litama_2_part0017.mp3,و لقاو الكسرة شد الطفل مورصو باه ياكل ماخلاتوش أُختو قالتلو مرت بابانا
data/baraa_litama_2_part0018.mp3,ماشي موالفة تخبزنها و ضُك راهم راحوا و خلاونا أستنى
data/baraa_litama_2_part0019.mp3,نفوتو نجربوها في الكلب رماو مورصو كسرة للكلب كي كلاها مات
data/baraa_litama_2_part0020.mp3,ولات مشات هي وخوها  مشاو مشاو مشاو مشاو مشاو وصلوا لعين البقر عْطش
data/baraa_litama_2_part0021.mp3,الطفل و قالها أُختي عطشت خليني نشرب من هاذيك العين قالتلو لالا
data/baraa_litama_2_part0022.mp3,يا خويا ماتشربش هاذي عين البقرة تعود تشرب و توليلي بقرة زاد مشاو مشاو مشاو
data/baraa_litama_2_part0023.mp3,وصْلو لعين الداب قالها أختي عْطَشِت نَشِرب قالتلو لالا يا خويا ماتشْربش تولي
data/baraa_litama_2_part0024.mp3,لي دابْ زادو مشاو مشاو مشاو لْقاو عين لحصان قالها أختي نشرب قالتلو لالا يا
data/baraa_litama_2_part0025.mp3,خويا ماتشربش تْعود توليلي حْصان  زادو مشاو مشاو مشاو لقاو عين لَغْزال قالها أختي
data/baraa_litama_2_part0026.mp3,نشرب قالتلو لالا تعود توليلي غْزال مسكين عطش بزاف خلاها مشات شوية
data/baraa_litama_2_part0027.mp3,و رْجع و شرب كي دارت لقاتو لْحَقْها غْزال قالتلو خْدَعَتْني يا خويا يا وليد اما و
data/baraa_litama_2_part0028.mp3,بويا قالها ماننْساكشْ يا خْتي حتى نموت راحوا لواحد لبلاصة هي طلعت للشَجرة و تبات
data/baraa_litama_2_part0029.mp3,و هو يبات تحت الشجرة تقعد هي في الشجرة و تمشط شعَرْها لواحد النهار جاء السُلطان يْشَرب
data/baraa_litama_2_part0030.mp3,لَحْصان تاعو  همالا لصقت شعرة طويلة في لسان لَحصان و ماحبش يشرب
data/baraa_litama_2_part0031.mp3,شاف السُلطان هاذاك لحصان لقى الشعرة دايرة على لسانو نحاهالو و قال مولات هاذي الش
data/baraa_litama_2_part0032.mp3,عرة ما تكون غير عدرة و راح قاس هاديك الشعرة على البنات كامل تاع الدشرة و مالقى
data/baraa_litama_2_part0033.mp3,حتى وحدة عندها شعر كيما هاديك الشعرة و لا رجع للعين
data/baraa_litama_2_part0034.mp3,شاف ظل الطفلة في الماء تاع الواد  طلع راسو لقاها فوق الشجرة قالها
data/baraa_litama_2_part0035.mp3,أَنْس ولا جنْ قالتلو أَنْس لا اله الا الله محمد رسول الله قالها اهبطي ما حبتْش راح و بعثلها
data/baraa_litama_2_part0036.mp3,لعجوز الستوت قالتلو أنا نقْدر نجيبهالك راحت الستوت تحت الشجرة و حطت تخبز
data/baraa_litama_2_part0037.mp3,في الكسرة على الطاجين و هو مقَلوب و جابت المعزة و تحلبها ف من قرونها و تَحْكَمها
data/baraa_litama_2_part0038.mp3,من ضرَعْها نَطْقت الطفلة و قالت لها ماشي هاكذاك قالتها الستوت أرواحي أخبزيلي مالا و أحلبيلي
data/baraa_litama_2_part0039.mp3,هبطت و خبزت لها و حلبتلها المعزة و لْغدوة من ذاك زادت رجعت الستوت و دارت نفس الخدمة و كي نزلت
data/baraa_litama_2_part0040.mp3,ربطتها حتى جاء السُلْطان همالا قالها نزَوج بيك قالتلو نقبل نَزوج بيك
data/baraa_litama_2_part0041.mp3,بَصح بْشَرط  مَا تاذيشْ خويا لَغْزال قالها شَرْطك مَقبول زَوجت بيه ولات عايشة في خيرْ بالخ
data/baraa_litama_2_part0042.mp3,ديمات في لَقْصَر يوم من لَيام جاء باباها يَطْلب طلت من التاقة عَرْفاتو قالت لل
data/baraa_litama_2_part0043.mp3,خدام قولولو يستنى حتى نخبزولو الكسرة خَبْزت الكسرة و دارت فيها الويز
data/baraa_litama_2_part0044.mp3,و بعثتهالو و قالتلو ما تَقْسَمهاشْ حتى تكون بين ولادك وصل للدار و حط الكسرة
data/baraa_litama_2_part0045.mp3,في الطابلة و قْسَمها طاح منها اللويز قالتْلو مرتو هاذي ماتكون غير بنتك لونجة
data/baraa_litama_2_part0046.mp3,غَدوة أدي خْتْها و رُوح لعندها كي داها فرحت بيها لونجة و قعدت هي و ختها
data/baraa_litama_2_part0047.mp3,يشمسو قدام البير خت لونجة طبعتها و طاحت لونجة في البير و كانت حامل بالتوام
data/baraa_litama_2_part0048.mp3,و راحت حَكْمت بلاصتها و كي جاء السلطان قالها واش بيك يا لونجة كْحَلْتي
data/baraa_litama_2_part0049.mp3,قالتلو من ماء بلادكم ،قالها وش بيها عينك عوارت قالتلو من كحل بلادكم قاللها
data/baraa_litama_2_part0050.mp3,وش بيه شعرك حراش قالتلو من زيتكم غَدوة من ذاك قالتلو أذبح لَغزال قالها كيفاه
data/baraa_litama_2_part0051.mp3,نَذبحو يخي تفاهمنا عليها قالتلو قلت لك أذبحوا سمع لغزال واش
data/baraa_litama_2_part0052.mp3,قالت العورة راح للبير و قعد يقول لونجة لونجة يا بنت ما
data/baraa_litama_2_part0053.mp3,لَمواسْ مضات و الطناجر غلات و خوك لَغْزال في المَمات قالتلو روح للسلطان و
data/baraa_litama_2_part0054.mp3,قولو يذبح بقرة و يشلحها و يملحها و يحطها على طرف البير راني ولدت و موسى على رُكبة و عيسى
data/baraa_litama_2_part0055.mp3,على رُكبة و لَحنش بو سَبْع روس يعس فينا سمعو الخُدام الهدرة هاذي
data/baraa_litama_2_part0056.mp3,و راحو قالو للسُلطان روح شوف لَغْزال واش يقول عند البير راح و طل يلقى لونجة مع لولاد ذبح
data/baraa_litama_2_part0057.mp3,البقرة و شلحها و ملحها خرج لحنش كلا اللحم و عطش راح يحوس على الماء جبدو لونجة
data/baraa_litama_2_part0058.mp3,هي و أولادها و حْكاتلهم كيفاه صرا هاذ الشي كامل حكم السلطان العورة ذبحها و نحالها راسها
data/baraa_litama_2_part0059.mp3,و طيبها و بعثها لماليها و دارو راس العورة في شكارة ْ و ركبوها فوق الدابْ
data/baraa_litama_2_part0060.mp3,باش يوصلو ليماها عرضت يماها الجيران باش ياكلو اللحم و تفرح و تقول سعدي ببنتي
data/baraa_litama_2_part0061.mp3,بعثتلي اللحم و الحمار يهدر و يقول ،تيس تيس راس العورة في التليس سمعاتو يماها
data/baraa_litama_2_part0062.mp3,و راحت للتليس و لقات راس بنتها عرفت باللي الشر اللي ديرو خلصاتو
data/baraa_wed3a_part0001.mp3,اهلا السلام عليكم اصدقاء مدونة التعليم بوخشم مريم
data/baraa_wed3a_part0002.mp3,اليوم مع قصة من تراثنا الجزائري الغني وهي قصة ودعة واخواتها السبعة
data/baraa_wed3a_part0003.mp3,قراءة ممتعة ودعة هاذي طفلة شابة بزاف و يتيمة
data/baraa_wed3a_part0004.mp3,توفى باباها و توفات أمها بعده خلاتها صغيرة عندها سبعة إخوة بخير
