file_name,transcription
data/baraa_part01_part09.mp3,لوكان ماناكلش مليح مع صبحة ربي راني رايحة الmood تاعي يخسر نهار كامل généralement تصرا بزاف هاذي ف الإقامة l'essentiel oversharit شوية ايه ثاني دارتلي واحد l'allergie مل لفراش هاذاك لي كان فلاقامة ايا و حكمني هاكا دارلي بزاف حب احمر رقيق ايا هاكا سما لازملي نروح عند dermatologue اني رايحة شوية هاكا نروح
data/baraa_part01_part10.mp3,شيرات توحشت لعراس قاع  la famille تاعنا واقيلا كملو تزوجو جات تورتنا فالدار vrai توحشت لعراس ني باغية نعرس هاد الصيف لازم ماكانش وحدة فيكم باغية تزوج ولا تزوجو زواج مليح راني قاعدة و قاعدة نهدر في باطل معلاباليش انايا شاراني ندير والله معلابالي شاراني ندير en tout cas تزوجو و عرضوني نعرس ماتخافوش
data/baraa_part01_part11.mp3,ماما عيطتلي تسقسي فيا شادرت اليوم وانا راني نايضة retard par ce que لبارح رقدت على الربعة لا حشمة لا حيا الرقاد تاعي راني خابطاته في حيط راني vrai خابطة الرقاد تاعي في حيط و انا مانعرفش نهدر بالعربية والله لا راني نسيي maximum راني نسيي كلمات راهم يتلفولي ومانيش نعرف نهدر سما راني نقول n'importe quoi
data/baraa_part01_part12.mp3,واحد زوج ثلاثة ربعة خمسة ستة سبعة ثمنية تسعة عشرة حداش ثناش ثلاطاش ربعطاش خمسطاش سبعطاش ثمنطاش تسعطاش عشرين واحدوعشرين ثنين و عشرين ثلاثة و عشرين ربعة و عشرين
data/baraa_part03_01.mp3,حبيت نكتب هاذ الكرونيك لي جاتي فبالي رح تكون باللهجة الجزائرية مع العمل هاذا  اول عمل ليا راح تحكي على طفلة شابة لي هي نهال هاذ الاسم نحبو معلباليش علاه في بارت رح تعرفو حكايتها و البطل تاعنا هو ايهاب رجل اعمال كبير و ناجح
data/baraa_part03_02.mp3,نهال طفلة في عمرها 20 سنة جاية بيضة و عينيها زروقة و شعرها كحل كي سواد الليل عندها واحد لطاي تقتل عايشة مع مانها و خالتها و زوج خياتها صغار عليها و بنت خالتها و وليد خالتها
data/baraa_part03_03.mp3,مان نهال لي هي خداوج جاية حنينة بزاف عمرها 68 سنة تحب نهال بزااف و هي لي رباتها و ربات خياتها بعد ما ماتو والديها
data/baraa_part03_04.mp3,هيبة : خت نهال في عمرها 17 سنة جاية بيضة كي نهال و تشبهلها في كلش غير في عينيها لي هوما كحولة و قلبها بيض و هاذ العام عندها الباك
data/baraa_part03_05.mp3,رى خت نهال الصغيرة في عمرها 15 سنة كيف كيف تشبه لنهال في كلش مام عينيها تقرى اولى ثانوي
data/baraa_part03_06.mp3,وهيبة : لي هي خالة نهال في عمرها 45 سنة عايشة معاهم في دار يماها بيسك هي مطلقة مع راجلها و عندها طفلة و طفل عايشين معاها
data/baraa_part03_07.mp3,لي هوما شهرة  بنت خالة نهال قدها فالعمر متف و متفاهمين كي الخيات كل حاجة يحكوها لبعضاهم و جاية خيرية شعرها شتان و عينيها نوازات امير  خو شهرة
data/baraa_part03_08.mp3,عندو 25 عام جاي طويل و عندو الكور و يظل مور شهرة و نهال بصح يحبهم و لي يطلبوه يجيبهولهم
data/baraa_part03_09.mp3,ايهاب رجل اعمال في عمرو 27 سنة هو مدير شركة لي كانت من قبل تاع باباه و الشركة هاذي تاع ملابس و ازياء اي يصنعو الحوايج و يعرضوهم للخارج و ايهاب جاي طويل و عندو واحد الكور يقتل و جاي سمر و عندو لحية مطارسية و عينيه بنيين
data/baraa_part03_10.mp3,ضوك نعرفو البطل تاعنا لي هوا ايهاب
data/baraa_part03_12.mp3,لامية ام ايهاب عندها 52 سنة مرا حنينة و تحب ايهاب بزااف خالد اب ايهاب عندو 54 سنة رح تعرفو شخصيتو مع الوقت
data/baraa_part03_13.mp3,ريان خت ايهاب عندها 22 عام و تقرا في لافاك ميدسين و جاية طويلة شوي و تشبه لخوها بزاف اكرم : خو ايهاب عندو 25 و يخدم مع خوه فالشركة جاي زل و بيض و عندو عينين حكولة كي شعرو و هاذي العائلة الكريمة تاع البطل ايهاب
data/baraa_part03_14.mp3,اصبحنا و اصبح الملك لله خالتي وهيبة : يا طفلة نوضي ما فهمتش كيفاه تقدري ترقدي حتى ل 11 انا : خالتي خليني نزيد شوية برك ( نهدر معاها و مزالني مغمضة عينيا ) خالتي وهيبة : الجيل هاذا يعرف غير الرقاد ايه حنا بكري كنا نوضو على 6
data/baraa_part03_15.mp3,انا خالتي بكري بكري و ضوك ضوك و  ديجا خليني كنت نام في عرسي راكي صمطتيهالي حتى العريس ماشفتش وجهو
data/baraa_part03_16.mp3,خالتي وهيبة : تنوضي و لا نوضك بطريقتي انا : روحي راني نايضة ديجا اصلا البارح خرجت من الخدمة حتى 1 و مارقدتش حتى 3 و زيد جاية تنوضي فيا بكري خالتي وهيبة : اصبري نشوف هاذا الزمر  منين يشعل نوضت نجري مبلاستي حتى تعكلت على الغطا و جبتها على راسي
data/baraa_part03_17.mp3,انا : خالتي تعيشي هاذاك وليدي بلاكي كاش ما ديريلو  خالتي علبالها بلي تيليفوني نقطة ضعفي علابيها قالت هكا خالتي وهيبة : شفتي كيفاه تنوضي ، دوك ازربي نوضي و اغسلي وجهك و امشي نديرو لميناج للدار علبالك قرب عر عرس وليدي
data/baraa_part03_18.mp3,نا : اففف هوما يعرسو و حنا نفرسو  بصح معليه في عرسي نخلفها خالتي : نوضي بركاي من الهدرة الزايدة
data/baraa_part03_19.mp3,بون نوضت و غسلت وجهي كانو خياتي راحو يقراو مام شهرة بيسك راهي ل 11 و هوما يقراو على 8 و رحت عاونت خالتي فالميناج نقينا كامل الحالة بيسك على 15 يوم عرس خويا امير شحال راني فرحانة فرحانة برك كي راح نبرد قلبي بالشطيح على 12 جاو خياتي باه يفطرو
data/baraa_part03_20.mp3,هيبة : رانا جينا انا : اهلا ختي جوزو اغسلو دوك نحطلكم الفطور راه واجد
data/baraa_part03_21.mp3,هيبة : هاتي بيزو قبل انا : غير الخير واش هاذ المحبة لي جاتك بدون سبب هيبة : نهار طيح عليا المحبة تقولي علاه و نهار تكون ناشفة تقولي علاه بيييي علاه بيييي نتي  والله  ما واحد والله واحد ما يفهمك
data/baraa_part03_22.mp3,انا : تزيدي دقيقة قدامي تلقاي البليغة في وجهك و تعرفيني نديرها هيبة : خلاص راني رحت جاز الوقت طلعت لبيتي باه نشوف الساعة نلقاها 5 ياه الوقت لازم نوجد روحي باه نروح للخدمة فتحت الخزانة قلبتها كامل نشوف واش نلبس من بعد خيرت هاذو خرجت نجري من الدار
data/baraa_part03_23.mp3,نلحق الطرونسبور قعدت ستنيت  شوية من بعد جا و طلعت لقيتو  لداخل معمر غاشي حتى بقيت  واقفة
data/baraa_part03_24.mp3,هاذا هو طرونسبور تاع دزاير جامي تصحلك بلاصة قاعد حتى وين لحقت لوين نخدم بون علبالي مراكوش فاهمين على هاذيك رح نشرحلكم كي قلت نشرحلكم راح خيالي للبروف تاع المات كي تكون تشرح نولو للمفيد انا نخدم سارفور فريستورون عالمي يجو ليه لي يخدمو ف ادارة اعمال
data/baraa_part03_25.mp3,و هاد الريستو مشهور بزاف يعني انا لي حبيت نخدم بيسك ماني بزاف عليها خلالها جدي المرحوم الشهرية مي ما تقدرش تصرف علينا كامل فالدار على هاذيك قلت نخرج نخدم باه نصرف عليا و على خاوتي و حبست قرايتي باه ما نخليش خاوتي يحسو بالوحدة بعد ما ماتو دارنا ربي يرحمهم فأكسيدون و مدام انا لكبيرة
data/baraa_part03_26.mp3,قررت نرفد واش بقالي من دارنا لي هوما خواتاتي باه ما يضيعوش و ما يخلوش قرايتهم دخلت وين نخدم رحت ديركت للاشومبر لي يبدلو فيها الحوايج لبست حوايج السارفور و دخلت للكوزينة  نشوف واش نساربي للناس ، قعدت نجري من طابلة لطابلة افف عييت
data/baraa_part03_27.mp3,حتى لحقت 10.30 كنت قاعدة فالكوزينة نفطر ياودي كرشي ولات اون كوبل مع ظهري من الجوع علبالي غاملة مي معليش تحملو حتى يجي سي ياسين
data/baraa_part03_28.mp3,ياسين هو الامي تاعي و يخدم معايا تعرفنا فالخدمة ياسين :  من الصباح و نا نجي من طابلة لطابلة و لالة قاعدة ترهج هنا انا: ايا ترهج معايا صح ما تاكولش قلع للخدمة حتى نكمل الماكلة باه نوض
data/baraa_part03_29.mp3,ياسين نتي لا بديتي تاكلي ما تحبسيش ما فهمتش واش عندك في كرشك انا : على زوج لقمات حسدتني فيهم هاه والله راك كوبيتلي لابيتي دخل علينا واحد يخدم تما و قال : الشاف وجد هاذ ليبلا لاطابل 28 و دار عندي : و نتي نهال كي يكمل يوجد روحي سيربي نتي وياسين
data/baraa_part03_30.mp3,انا : اكي ريڨل الخدام : ولازم تتعاملو معاهم مليح بيسك تاع ادارة اعمال و جا معاهم واحد رئيس الشركة  اسم الشركة انا : ما تخافش ما يكون لا خاطرك هو : نعرف ما تخافش تاعك راني نوصي فيك بلاكي تبهدلينا انا : خسارة عليك ما ديرش فيا كونفيونص
data/baraa_part03_31.mp3,هو : همال نتكل عليك نهال انا : حاجة باينة  درت عند ياسين حتى نطق قبلي و قال : هاذ السيد دسرك و نتي حليتيلو العين انا : باه ما يكثرش الهدرة ما يكثرش معايا الهدرة برك خلينا منو و رحنا بدينا نرفدو فليبلا و اتجهنا نحو الهدف قصدي نحو الطابلة وصلنا و بديتا نسيربو الماكلة و كنت مهبطا راسي انا غير طلعتو طاحت عيني فوحد الزل ياخويا ياخويا
data/baraa_part03_32.mp3,واش نحكيلكم  من بعد فقت على روحي بلي راني نخزر فيه و ليت رحت جهة ياسين و وقفت معاه ياسين و هو يهدر مع الناس : بون ابيتي و اذا عندكم طلب اخر رانا هنا نطق هذاك البقلاوة : مي انا دومونديت حوت و قلت ما نحبش فيه الطوماطيش علاه حطيتوه فيه
data/baraa_part03_33.mp3,انا : باه تطلق البنة البقلاوة : لازم تسيربو على حساب لادوموند ماشي من راسكم فهمتو  قالها بلعياطياسين : سمحلنا ميسيو غلطة برك هو : قال غلطة قال ازربو دوك ترفدو عليا هاذا و تجيبو بلا اخر بلا طوماطيش
data/baraa_part03_34.mp3,ميشت انا حتى وصلت قدامو بيسك قلقني و رفدت هاذيك الطوماطيش لي كانت ملفوق بيدي و نحيتها حطيتها فطبسي فارغ و رفدتو و قتلو : هكذا راهي بلا ساهلة برك نتا صعبتها
data/baraa_part03_35.mp3,خلط الطابلة و وقف و بدا يعيط حتى الغاشي كامل ولاو يتفرجو جيهتنا هو : واش درتي ما فهمتش كيفاش يخدمو عيباد كيما نتي هنا و كي رفدتيهم بيدك وين علبالي يديك ايلا مخسولين ولا معفونين و زاد فالعيطة تاعو
data/baraa_part03_36.mp3,دوك ترفدي قسام هاذ البلا و تجيبي وحداخر و لا سينو ما تزيديش دقيقة فالخدمة تاعك انا : اولا شكون نتا باه تعيط عليا هكا و قدام الناس و ثانيا الحمد لله يديا نقايا على وجهك و ثالثا واش حاسب روحك باه تهددني اه حكمني من يدي و زيد عليها : شكون نتي باه ترفدي صوتك عليا و تهدري معايا بهاد لافاصو معلبالكش شكون انا انا ايهاب  رئيس الشركة تاع الملابس و الازياء فهمتي
data/baraa_part03_37.mp3,انا : ما قتلكش عرفني بروحك و ما يخمنيش  ما يهمنيش شكون نتا جبدت يدي من عندو و رحت و خليتو دخلت للكوزينة و النار شاعلة فياؤانا : واش حاسب روحو هادا جاي يعيط عليا و يهدد فيا قال انا ايهاب  رئيس الشركة زعما تعكي فيه  واش دخلني انا فيك اففف
data/baraa_part03_38.mp3,و هي هكاك تعيط حتى دخل ياسين ياسين : واش درتي نتي حمارة ولا اغيول علبالك يقدر صح يحاوزك منا انا : ما عندو ما يدير اصلا ما شفتش كيفاه حاسب روحو زعما مدير الشركة جاي يعلي فروحو قدام الناس و لاعبها ما ياكلش الطوماطيش انا فالدار كي يحكمني الجوع فنص الليل نديرها فالخبز مع الملح و ناكلها والله جي بنينة
data/baraa_part03_39.mp3,ياسين : يخي مكراشة يخ علبالي مكاش لي كيما نتي انا : وي علبالي بلا ما تقولي
data/baraa_part03_40.mp3,عند ايهاب ليوم  كان عندي عشا مع وحد الجماعة من انجيلترا على جال توقيع الشراكة بيني و بينهم و رحنا لواحد الريستو يعني هو معروف مي انا جامي رحتلو بيسك منحبش نروح لبلايص معروفة مي الشركة الانجليزية كي سمعو بيه عجبهم و حبو يروحو تما مور ما وصلنا و دومونديتا ليبلا انا دمونديت حوت مشوي و قلت بلا طوماطيش
data/baraa_part03_41.mp3,مي ما فهمتش علاه ما يسمعوش و جابتهولي وحدة الطفلة ملول كي طاحت عيني فيها اممم واش نحكي يا ربي وحد الزلة من بعد قلت واش دخلني فيها بيسك انا مالجوغ لي نكره البنات و كي قتلها بدلي البلا رفدت هاديك الطوماطيش لي ملفوق بيدها و تحاتها و انا معياف بزاف على هاذيك صرا واش صرا حكيت لفوق جاتني شقوة نعاود
data/baraa_part03_42.mp3,راحت جا مول الريستو و قالي : سمحلنا ميسيو هذاوين سمعت بلي صرا و اذا تقبل مني راح يكون عشاكم خالص من عندنا ايهاب: ما يهمنيش و. حبيت نعرف شكون هاذيك الطفلة لي سيربات هو : هاذيك نهال تخدم سارفور هنا انا : نحبها تتحاوز منا و نعطيك واش تحب هو : ما يكون غير خاطرك ميسيو ايهاب و راك شرفت الريستو بمجيئك ما رجعتلوش بيسك قلقني بهدرتو
data/baraa_part03_43.mp3,نرجعو عند نهال كنت قاعدة فالكوزينة مع ياسين لي نساني فواش صرا و راحلي لقلق حتى دخل عليا السي احمد لي هو مدير الريستو هنا و قال : نهال من اليوم و رايح
data/baraa_ytb_part0001.mp3,السلام عليكم اخواني اخواتي ادعمنا بلايك و اشترك في القناة ليوم جيتكم بحكاية
data/baraa_ytb_part0002.mp3,قرن فضة و قرن ذهب بسم الله بديت و على نبي صليت كان يا مكان في قديم الزمان كانو وحد
data/baraa_ytb_part0003.mp3,ثلث بنات يتامى عايشين وحدهم في واحد الدار واحد المرة قاعدين متوانسين نطقت البنت لكبيرة قالت لخواتاتها وش امنيتكم
data/baraa_ytb_part0004.mp3,فهاد الدنيا نطقت الوسطانية قالت انا متمنية ندي الحلواجي تاع السلطان و نطقت لكبيرة و قالت
data/baraa_ytb_part0005.mp3,وانا متمنية ندي الطباخ تاع السلطان بقات ختهم الصغيرة ساكتة دارو ليها و قالولها و نتيا واش راكي حابة نطقت ختهم
data/baraa_ytb_part0006.mp3,ليهم و قاتلهم انا كون نقولكم توليو تضحكو عليا امالا مانقولش بقاو وراها حتى قاتلهم يلي راهي حابة تتزوج بالسلطان
data/baraa_ytb_part0007.mp3,ضحكو عليها خواتاتها و في هاداك الوقت كان السلطان فايت ملباب دارهم وسمع لحديث لي دار بيناتهم
data/baraa_ytb_part0008.mp3,ولا لقصر كي ولا لقصر طلب ملخدامة تاعو يروحو لهاديك الدار و يجيبو هادوك ثلث بنات
data/baraa_ytb_part0009.mp3,كيما كان الحال راحو الخدامة للدار و امرو هادوك البنات و قالولهم بلي السلطان راهو حا يسحقكم خافو لبنات
data/baraa_ytb_part0010.mp3,مع لول بصح مايقدروش يرفضو للسلطان طلبو هزو بعضاهم و راحو للقصر بدا السلطان يسقسي فيهم
data/baraa_ytb_part0011.mp3,سقسى لكبيرة لولة و قالها نتيا بيمن حابة تزوجي قاتلو ياسيد السلطان انا حابة نزوج بالطباخ
data/baraa_ytb_part0012.mp3,تاعك قالها ضرك نزوجك بيه و هاو ليك واش حبيتي زاد دار لتانية و قالها و نتيا
data/baraa_ytb_part0013.mp3,بيمن حابة تزوجي قاتلو ياسيد السلطان انا حابة نزوج بالحلواني تاعك قالها و نتي تاني ضرك نزوجك بيه
data/baraa_ytb_part0014.mp3,و ليك كيما ختك دي واش حبيتي بقات ختهم الصغيرة تلفت ليها السلطان و قالها
data/baraa_ytb_part0015.mp3,ونتيا بمن حابة تزوجي حشمت البنت و خافت مالسلطان ولات تبكي شاف السلطان معاها و قالها
data/baraa_ytb_part0016.mp3,حبيت نطلب منك طلب ايادرا تقبليه ولا لالا شافت معاه البنت الصغيرة و قاتلو اطلب يا سيد
data/baraa_ytb_part0017.mp3,السلطان قالها تتزوجي بيا فرحت البنت الصغيرة و قاتلو نقبل بالفرح و السرور
data/baraa_ytb_part0018.mp3,و تزوجو روح يا زمان و ولي يا زمان هزت هاديك مرت السلطان وجابت
data/baraa_ytb_part0019.mp3,طفل و طفلة توام طفل عندو قرن فضة و طفلة عندها قرن ذهب كانو فرحانين بيهم
data/baraa_ytb_part0020.mp3,لأقصى حد مبعدا السلطان جاتو مهمة تاع حرب في بلاد بعيدة و قرر
data/baraa_ytb_part0021.mp3,بأه يروح و كانو خواتات مرتو غيرانين منها علي عايشة فهاداك الخير و زاد جابت طفل و طفلة
data/baraa_ytb_part0022.mp3,بقرن فضة و قرن ذهب و تشاورو بيناتهم و قالو لازمنا نديو صغارها و نشتوهم
data/baraa_ytb_part0023.mp3,المهم ماتقعدش هانية و كيما كان الحال سافر هاداك السلطان وراح للحرب لخواتات الشريرات قعدو يترقبو
data/baraa_ytb_part0024.mp3,حتى في ليلة من ليالي رقدو اهل القصر كامل دخلو هادك زوج خواتات شيطانات و راحو عند ختهم و داو
data/baraa_ytb_part0025.mp3,زوج ولاد و حطوهم في القفة و حطوهم فالواد لغدوة منداك كاين واحد الحطاب فالغابة كي راح للواد
data/baraa_ytb_part0026.mp3,ضرب بعينو لقى هاديك القفة حلها لقى فيها زوج ولاد راح يجري فرحان لمرتو و قالها حنا
data/baraa_ytb_part0027.mp3,ربي مارزقناش لولاد بصح شوفي واش لقيت يامرا قاتلو واش لقيت يا راجل حللها القفة لقات هادوك زوج ولاد فرحو بزاف
data/baraa_ytb_part0028.mp3,و سماو الطفل جميل و الطفلة جميلة اما لخواتات راحو خبرو السلطان بعد ما جا من السفر و قالو
data/baraa_ytb_part0029.mp3,لو بلي مرتو عمرها لا حباتو و راحت رمات ولادو تغشش السلطان وحكم
data/baraa_ytb_part0030.mp3,المرا تاعو و حطها فالحبس جميل و جميلة قعدو عند هاداك الشايب و لعجوز مربيينهم حتى كبرو
data/baraa_ytb_part0031.mp3,روح يا زمان و ولي يا زمان مرضت العجوزة هاديك وقبل ما تموت وصات راجلها و قاتلو توله يا راجل
data/baraa_ytb_part0032.mp3,لازم تقول لجميل و جميلة الحقيقة و تقولهم بلي رانا مربيينهم وحنا ماناش والديهم تاع الصح ولازم عليهم يحوسو على والديهم الحقيقيين
data/baraa_ytb_part0033.mp3,ماتت لمرة و بقى الراجل مع جميل و جميلة فات زمان زاد
data/baraa_ytb_part0034.mp3,مرض الراجل و هو على فراش الموت عيط لجميل و جميلة و قالهم لازملي نقولكم الحقيقة حنا ماشي والديكم
data/baraa_ytb_part0035.mp3,و والديكم تاع الصح مانعرفوهمش انا لقيتكم فالواد محطوطين في قفة هزيتكم و جبتكم ربيناكم فات وقت قصير ومات هاداك
data/baraa_ytb_part0036.mp3,الشايب وقعدو جميل و جميلة وحدهم ولا جميلة كل نهار يروح يصيد و جميلة
data/baraa_ytb_part0037.mp3,تروح معاه يحطها فوق حصانو هو يصيد و هي تلعب و في  مرة من المرات جاو فايتين خوالاتهم الشريرات
data/baraa_ytb_part0038.mp3,و شافوهم و عرفوهم من القرون تاعهم القرن فضة و القرن ذهب بلي راهم ولاد ختهم  شافو مع بعضاهم و قالو
data/baraa_ytb_part0039.mp3,لازملنا نتخلصو منهم لا يتكشف أمرنا و كيما كان الحال راحو عند واحد الستوت و حكاولها لحكاية وقالولها
data/baraa_ytb_part0040.mp3,لازمك تعاونينا باه نتخلصو منهم قاتلهم الستوت ماكان حتى مشكل راحت الستوت هاديك و بقات تعس في جميل و جميلة
data/baraa_ytb_part0041.mp3,واحد نهار جا جميل يصيد كيما العادة و قال لجميلة هايا تروحي معايا ماحبتش جميلة قالتلو
data/baraa_ytb_part0042.mp3,روح برك ياخويا وانايا نقعد عندي شغالات بزاف فدار و لازملي نخلصهم راح جميل و وصى ختو باه ماتحلش لباب
data/baraa_ytb_part0043.mp3,قاتلو روح وماتخافش ياخويا روح مهني راح جميل يصيد و ستوت هاديك راهي تعس لقات جميل راح راحت طبطبت عل الباب
data/baraa_ytb_part0044.mp3,جميلة وقالت للستوت وشكون نتي نطقت الستوت ليها وقالتلها انا حبيبة مك
data/baraa_ytb_part0045.mp3,و جيت نفاقد فيكم نتيا و خوك دخلتها جميلة لجنان وفرحت بيها ستوت شافت مع لجنان وقالتلها لجنان تاعك مليح
